,hotelID,TripAdvisor Review,Trip_neg_score,Trip_neut_score,Trip_pos_score,Trip_osat_label,Expedia_User_Comments,Expedia_neg_score,Expedia_neut_score,Expedia_pos_score,Expedia_osat_label
4,8268,"     Residence Inn Las Vegas Hughes Center Hotel Reviews Page 9  below expectations I've stayed at other Residence Inns and had better experiences. Compared to other similar hotels (to include other Residence Inns), the rooms are very small, and I felt clausterphobic. The breakfast area was ok and well stocked, but the general feel of the hotel was depressing. Maybe it's because of the location in Vegas, but as a regular business traveler, I hope I don't have to stay there again. Location was ok for me as I had business in the Wells Fargo building. Their are chain resturuants within walking distance. It's a long walk to the Strip, or a short cab ride. There's usually one or two cabs waiting out front; otherwise, I found one passed by every so often.  Handy Location This hotel is close to the airport, although they do not offer a hotel van for guests. Not a problem, a taxi was only about $15 which included a tip. ... The room was comfortable and clean. The WiFi worked well and there was a good breakfast which started early. The front desk staff were friendly and welcoming. We were satisfied with our stay and would recommend it to others. (If driving, take the Flamingo Exit off I-15 and go east.)
Room Tip: The bell on the elevator is set too loud. I would recommend not staying too close to the lifts.
See more room tips
Green Features: As with other Marriott properties, they seem to be in step with current environment steps to conserve.  Great Experience! Stayed at this hotel for 2 days on Labor Day weekend. Location was great, away from the hustle bustle of the strip but not that far, about 10 min drive. It was surrounded by nice restaurants: Fogo de Chao, Gordon Birsch, McCormick, Lawrys. Staff was friendly, room is clean, building is well-maintained. Breakfast buffet was great as well and dining area was spacious but still tends to get packed during peak hours so you should plan to come early as they suggest. Check-in time was 4pm but we came around 3pm and were allowed to check-in. We were so tired from traveling for more than 4 hours from Los Angeles so we appreciated that so much. Overall experience was really great and will surely come back.  A Mile from the Strip-Calm and Caring Service Tonight is my first night at the Residence Inn Las Vegas Hughes Center. The front desk staff welcomes you warmly. The rooms are in excellent condition. Breakfast is available in the morning. I walked to the Strip and back in the evening and felt pretty safe, but I would suggest taking a taxi in the evening for added security. I LOVE walking. If you enjoy a good walk or a pool and jacuzzi to take in the rays, enjoy this peaceful hotel with the extra space that the Marriott Residence brand provides. I would bring my family for leisure.
P.S. The Hard Rock, McCormicks and Schmicks, Landry and many other hotels are just a minute walk.
Room Tip: I stayed on the fifth floor and there was hardly any outdoor noise.
See more room tips  Excellent Hotel Just stayed at the Residence Inn Hughes Center in Las Vegas and had a great experience. The place is clean, well run, great service,and has all the amenities of Residence Inn (full kitchen, breakfast every morning, gym, etc.) Highly recommended.  Good one night option coming to and from the airport We got in late to Vegas and wanted a place to stay away from the strip before leaving the next morning for Zion. On the way back from ZNP, we needed a place for a one night stay again before leaving the next morning to return home. This hotel had a very friendly and easy check-in. Free parking was in a garage right behind the hotel with easy access to the elevators.

The rooms were comfortable and clean and the breakfast in the morning was well stocked with several employees working hard to clear tables and keep everything stocked. There are several restaurants within walking distance. We ate at Gordon Biersch and enjoyed our meal and drinks. It was a Monday evening and there was a manager meal of chicken we opted to not eat but it looked like lots of guests were enjoying it.

The hotel is close to a Starbucks for a morning coffee, a gas station to refill the rental car before heading to the airport, and a Fed Ex in case you did too much shopping.

The hotel is ~15 minutes from the airport. We would definitely stay here again if in Vegas again.
Room Tip: There are office buildings close by so pick a higher level to avoid hearing traffic
See more room tips  Good for non smokers Most of the casino hotels reek of smoking but this isn't a casino so doesn't have this problem. Rooms are large well equipped and comfortable. Pool is a bit basic but car park is good. There are good places nearby to eat and the free breakfast is good. Staff were friendly and efficient.
Disadvantage is that it's a bit far from the strip but there are buses and taxis.
Room Tip: Better views up high. Fairly quiet area.
See more room tips
Green Features: Not sure about these but seems a sensible hotel. They did not make a feature of this.  Worked well for our short stay We were in Vegas for 8 nights - 7 at the Grand Chateau and needed a place for extra night before flying home on Saturday. We had a free Marriott night so chose the Residence Inn which was perfect for our last night in town. Its off the strip but close to restaurants. Breakfast was crowded but well stocked and we were there early so didnt have to wait in much line. Always like having kitchenette and we did enjoy the pool in the afternoon. I would recommend this hotel for the price and if you want to be off the strip but close to UNLV.  Decent hotel. Bad internet, small gym/pool, public laundry. My overall stay at the hotel was not a bad experience. Everyone was friendly and helpful. There is breakfast every morning and dinner on Mondays/Tuesdays/every other Wednesday. There is a small shop where you can pick up wine, beer, snack food, soda, tea, and microwaveable items. The room is fairly cozy. It had a couch, chair, desk, office chair, two bar stools, small counter top bar, small kitchen, large fridge, decent closet space, single dresser, two nightstands, large bathroom mirror, and a small full bathroom separate from the bathroom sink.

There are some drawbacks to this hotel though through the amenities. The rooms do not have washers/dryers like in other extended stay hotels. You are forced to pay $3 to wash and dry your clothes in a central wash room on 3 of the floors, each containing 2 washers/dryers. The internet is free, unless you pay to upgrade the bandwidth. The drawback to the internet is that the service provider/equipment that the hotel has is horrible. Even if you pay to have the faster internet, you still have tons of packet loss and high latency, even during non-peak hours. If you are a gamer, avoid the thought of even playing while here. It is probably at the top of my list for worst hotel internet connection. I notified the business and was given a code to use to try and remedy the issues with the connection (as I need the internet for work) and the issues were not resolved. If you are athletic and like to workout, the gym has a few cardio machines and free weights. The gym is absolutely lacking. The pool is small and usually full of kids. There is a decent hot tub.

TL;DR:
-Good service
-Decent room
-Free breakfast everyday
-Free dinner Mondays/Tuesday/every other Wednesday
-Off the strip, but close enough to everything
-Horrible free/paid internet
-Public laundry
-Small pool
-Hot tub
-Tiny gym
Room Tip: A room facing towards the strip has its perks. View of the strip and the pool.
See more room tips  Great hotel off the Strip We stayed at this hotel for one night and moved to the Mirage for three nights. It is so much easier to get to the room without having to go through the casino. This property would work best for people who has a rental car, otherwise staying on the Strip would be most convenient. The free breakfast in the morning is a plus. There is no resort fee charge which can add quite a bit to the room cost.
Room Tip: High floor, away from elevator
See more room tips    ",0.55,0.73,0.45,"""neutral""","   Stayed for thanksgiving holiday, The entire staff was warm and caring.  Just awesome    Enjoyed our stay. Which we stayed for a few days.    Hotel is very clean.  Was greeted by warm staff from the moment I walked in.  Nice restaurant and bar.  Would stay again.  Staff is always the best! Accommodate every request.  Very nice hotel for a very reasonable rate. Very comfortable night sleep, friendly and attentive staff. One Bistro is a very nice restaurant. The best onion soup I have had.  This was our first time to stay at a Four Points hotel and we will definitely return - especially to this one in Norwood.The seasonal decorating outside with flowers and pumpkins made a wonderful 1st impression and was so welcoming! It appeared to be a very busy weekend with several weddings but the front desk was well staffed and everyone we spoke to was very pleasant and helpful. The room was very quiet and comfortable. We loved the sleek wall-mounted shampoo, conditioner & shower gel station, instead of having all the little bottles cluttering up the counters. Nice hotel, nice staff, good value.  1st the hotel is so dated, everything is loose, like the door handle, door lock, shower handle etc.  The a/c /heat is blowing right in front of the bed that gives me a massive margin.  On top of that on Sat night about 0150 there's lots of noise and loud come across the hall and so I kinda let it go, as people need a bit of time to catch up etc then when it comes to 0238 still never die down, so I've called down to the front desk and complain and so they sent a security guy up.  He (Security guy) knock on my door and ask did we call to complain about the noise!!!  First of all why is he knocking on my door and had to get up OUT OF BED to confirm !!!!  Does he not see that the noise literally across from my door?!?!?!?!  I was NOT a happy camper for him to drag me out of bed to answer the door for something like that!!!!!!!!!  When I check out I didn't get a print out as they offer to e-mail to be more environmentally which I understand and they did confirm we had A (ONE) charge from the restaurant.  When I come home at the bottom it said double the charges.  I'm not sure am I reading it wrong but it said Total: $50 something as there's two charges for $20 something!  So I had to called and the front desk girl doesn't seem to understand.  So she claim she only see one charge and I've asked her to e-mail that to me and what it turns out to be the 3rd e-mail I've received to be the exact same thing that the total charge is fifty something dollars!  I've ask her to get back to me   from the moment we walked in, the employees made us feel welcome and answered all of our questions. The room was very nice and modern. I enjoyed the workout facility as well .  Went to the game could not get back in. Nothing stating doors are locked after 1130.   Assumed card swipe would open doors.  But no.   In a football town they should have services open for people getting in in the early morning hours   Stayed at this hotel on the way back from helping our daughter move into an apartment in Boston.  Have never stayed at a Sheraton, got an excellent rate on Expedia.  It is a large, updated property with banquet facilities, on-site restaurant and bar, separate breakfast area off the lobby, lovely pool area with jacuzzi.  The room was beautiful, perfect for 2 people; queen size bed had nicer than average bedding and was very comfortable.  Furnishings were very nice, plenty of drawer space; bathroom was very clean, lots of towels, shower stall seemed larger than average and had dispensers on shower wall with body wash, shampoo and conditioner, what a great idea.  My only complaint was that I found the on-site restaurant to be very expensive, however there are lots of restaurants just down the street so we just went to a hibachi place.  Every front desk employee we met was super helpful and friendly.  Hotel is in great location, just off I-95 and it's a quick trip into Boston.  I would stay there again and would highly recommend.  Great location, attentive staff, nice facilities and price is comparable to nearby lesser hotels. Will definitely stay here again   I checked in late so I couldn't enjoy all the amenities the hotel had to offer but I loved the room. Most comfortable bed ever! Staff was friendly and courteous. Very enjoyable experience.   Hotel isn't too far from Gillette stadium, which is where we were coming from. Staff was very friendly, from the front desk to the restaurant. Our room was perfectly clean. There was a slight odor (I couldn't really place it) in the hall, but not in the room. The HVAC and the room was quiet. Not much of a view but the property was nice, clean, and well landscaped. The room was on the small side but it was enough space for my wife and myself. We weren't blown away by the breakfast, but it was nice that they had a large variety. We didn't get a chance to eat in the bistro, as it's not open for breakfast. I would not hesitate to stay here again, or recommend it to anyone in the area.  The curtains in the hotel room do not close to block out the light.  This is insane to me.  I typically don't like when people give a hotel a bad review over one tiny issue, but this issue had just too big of an impact on our stay to ignore.In the summer the sun rises at 6am.  Meaning our room was flooded with daylight at 6am.  The morning after a concert at Gillette stadium.Insane.  The staff was incredible, especially Linda at the Front Desk. Offered tips getting to Gillette then in the morning asked how the concert went... Just added to an already great weekend  The hotel appearance was excellent upon entry. I had a girl help me check in. She was unable to accommodate my request& needed help. The woman who  helped started with NO... This did not impress me. She even just walked away. The young girl still tried and a manager came over, asked me questions about my needs and worked it out...that was customer service! All I needed was my two rooms to be together because we had teenagers with us.  The rooms were close and one was switched to a suite. She even comped us breakfast due to the inconvenience.  We asked for a early check in they made it happen and were more than happy to do it.  We came for a concert. Checked in late. Our room was VERY clean and the bed was a memory foam top. Super comfy. The only issue was the shower head was either trickle or narrow jet stream. Def would stay again. Hotel is beautiful and seems recently upgraded.  Room was neat and clean. Everyone was very polite and pleasant. The Hotel has easy access to the highway.   Pool had very nice renovation, room was very comfortable, clean and updated. Restaurant inside hotel was very good.     Stayed for thanksgiving holiday, The entire staff was warm and caring.  Just awesome    Enjoyed our stay. Which we stayed for a few days.    Hotel is very clean.  Was greeted by warm staff from the moment I walked in.  Nice restaurant and bar.  Would stay again.  Staff is always the best! Accommodate every request.  Very nice hotel for a very reasonable rate. Very comfortable night sleep, friendly and attentive staff. One Bistro is a very nice restaurant. The best onion soup I have had.  This was our first time to stay at a Four Points hotel and we will definitely return - especially to this one in Norwood.The seasonal decorating outside with flowers and pumpkins made a wonderful 1st impression and was so welcoming! It appeared to be a very busy weekend with several weddings but the front desk was well staffed and everyone we spoke to was very pleasant and helpful. The room was very quiet and comfortable. We loved the sleek wall-mounted shampoo, conditioner & shower gel station, instead of having all the little bottles cluttering up the counters. Nice hotel, nice staff, good value.  1st the hotel is so dated, everything is loose, like the door handle, door lock, shower handle etc.  The a/c /heat is blowing right in front of the bed that gives me a massive margin.  On top of that on Sat night about 0150 there's lots of noise and loud come across the hall and so I kinda let it go, as people need a bit of time to catch up etc then when it comes to 0238 still never die down, so I've called down to the front desk and complain and so they sent a security guy up.  He (Security guy) knock on my door and ask did we call to complain about the noise!!!  First of all why is he knocking on my door and had to get up OUT OF BED to confirm !!!!  Does he not see that the noise literally across from my door?!?!?!?!  I was NOT a happy camper for him to drag me out of bed to answer the door for something like that!!!!!!!!!  When I check out I didn't get a print out as they offer to e-mail to be more environmentally which I understand and they did confirm we had A (ONE) charge from the restaurant.  When I come home at the bottom it said double the charges.  I'm not sure am I reading it wrong but it said Total: $50 something as there's two charges for $20 something!  So I had to called and the front desk girl doesn't seem to understand.  So she claim she only see one charge and I've asked her to e-mail that to me and what it turns out to be the 3rd e-mail I've received to be the exact same thing that the total charge is fifty something dollars!  I've ask her to get back to me   from the moment we walked in, the employees made us feel welcome and answered all of our questions. The room was very nice and modern. I enjoyed the workout facility as well .  Went to the game could not get back in. Nothing stating doors are locked after 1130.   Assumed card swipe would open doors.  But no.   In a football town they should have services open for people getting in in the early morning hours   Stayed at this hotel on the way back from helping our daughter move into an apartment in Boston.  Have never stayed at a Sheraton, got an excellent rate on Expedia.  It is a large, updated property with banquet facilities, on-site restaurant and bar, separate breakfast area off the lobby, lovely pool area with jacuzzi.  The room was beautiful, perfect for 2 people; queen size bed had nicer than average bedding and was very comfortable.  Furnishings were very nice, plenty of drawer space; bathroom was very clean, lots of towels, shower stall seemed larger than average and had dispensers on shower wall with body wash, shampoo and conditioner, what a great idea.  My only complaint was that I found the on-site restaurant to be very expensive, however there are lots of restaurants just down the street so we just went to a hibachi place.  Every front desk employee we met was super helpful and friendly.  Hotel is in great location, just off I-95 and it's a quick trip into Boston.  I would stay there again and would highly recommend.  Great location, attentive staff, nice facilities and price is comparable to nearby lesser hotels. Will definitely stay here again   I checked in late so I couldn't enjoy all the amenities the hotel had to offer but I loved the room. Most comfortable bed ever! Staff was friendly and courteous. Very enjoyable experience.   Hotel isn't too far from Gillette stadium, which is where we were coming from. Staff was very friendly, from the front desk to the restaurant. Our room was perfectly clean. There was a slight odor (I couldn't really place it) in the hall, but not in the room. The HVAC and the room was quiet. Not much of a view but the property was nice, clean, and well landscaped. The room was on the small side but it was enough space for my wife and myself. We weren't blown away by the breakfast, but it was nice that they had a large variety. We didn't get a chance to eat in the bistro, as it's not open for breakfast. I would not hesitate to stay here again, or recommend it to anyone in the area.  The curtains in the hotel room do not close to block out the light.  This is insane to me.  I typically don't like when people give a hotel a bad review over one tiny issue, but this issue had just too big of an impact on our stay to ignore.In the summer the sun rises at 6am.  Meaning our room was flooded with daylight at 6am.  The morning after a concert at Gillette stadium.Insane.  The staff was incredible, especially Linda at the Front Desk. Offered tips getting to Gillette then in the morning asked how the concert went... Just added to an already great weekend  The hotel appearance was excellent upon entry. I had a girl help me check in. She was unable to accommodate my request& needed help. The woman who  helped started with NO... This did not impress me. She even just walked away. The young girl still tried and a manager came over, asked me questions about my needs and worked it out...that was customer service! All I needed was my two rooms to be together because we had teenagers with us.  The rooms were close and one was switched to a suite. She even comped us breakfast due to the inconvenience.  We asked for a early check in they made it happen and were more than happy to do it.  We came for a concert. Checked in late. Our room was VERY clean and the bed was a memory foam top. Super comfy. The only issue was the shower head was either trickle or narrow jet stream. Def would stay again. Hotel is beautiful and seems recently upgraded.  Room was neat and clean. Everyone was very polite and pleasant. The Hotel has easy access to the highway.   Pool had very nice renovation, room was very comfortable, clean and updated. Restaurant inside hotel was very good.     Stayed for thanksgiving holiday, The entire staff was warm and caring.  Just awesome    Enjoyed our stay. Which we stayed for a few days.    Hotel is very clean.  Was greeted by warm staff from the moment I walked in.  Nice restaurant and bar.  Would stay again.  Staff is always the best! Accommodate every request.  Very nice hotel for a very reasonable rate. Very comfortable night sleep, friendly and attentive staff. One Bistro is a very nice restaurant. The best onion soup I have had.  This was our first time to stay at a Four Points hotel and we will definitely return - especially to this one in Norwood.The seasonal decorating outside with flowers and pumpkins made a wonderful 1st impression and was so welcoming! It appeared to be a very busy weekend with several weddings but the front desk was well staffed and everyone we spoke to was very pleasant and helpful. The room was very quiet and comfortable. We loved the sleek wall-mounted shampoo, conditioner & shower gel station, instead of having all the little bottles cluttering up the counters. Nice hotel, nice staff, good value.  1st the hotel is so dated, everything is loose, like the door handle, door lock, shower handle etc.  The a/c /heat is blowing right in front of the bed that gives me a massive margin.  On top of that on Sat night about 0150 there's lots of noise and loud come across the hall and so I kinda let it go, as people need a bit of time to catch up etc then when it comes to 0238 still never die down, so I've called down to the front desk and complain and so they sent a security guy up.  He (Security guy) knock on my door and ask did we call to complain about the noise!!!  First of all why is he knocking on my door and had to get up OUT OF BED to confirm !!!!  Does he not see that the noise literally across from my door?!?!?!?!  I was NOT a happy camper for him to drag me out of bed to answer the door for something like that!!!!!!!!!  When I check out I didn't get a print out as they offer to e-mail to be more environmentally which I understand and they did confirm we had A (ONE) charge from the restaurant.  When I come home at the bottom it said double the charges.  I'm not sure am I reading it wrong but it said Total: $50 something as there's two charges for $20 something!  So I had to called and the front desk girl doesn't seem to understand.  So she claim she only see one charge and I've asked her to e-mail that to me and what it turns out to be the 3rd e-mail I've received to be the exact same thing that the total charge is fifty something dollars!  I've ask her to get back to me   from the moment we walked in, the employees made us feel welcome and answered all of our questions. The room was very nice and modern. I enjoyed the workout facility as well .  Went to the game could not get back in. Nothing stating doors are locked after 1130.   Assumed card swipe would open doors.  But no.   In a football town they should have services open for people getting in in the early morning hours   Stayed at this hotel on the way back from helping our daughter move into an apartment in Boston.  Have never stayed at a Sheraton, got an excellent rate on Expedia.  It is a large, updated property with banquet facilities, on-site restaurant and bar, separate breakfast area off the lobby, lovely pool area with jacuzzi.  The room was beautiful, perfect for 2 people; queen size bed had nicer than average bedding and was very comfortable.  Furnishings were very nice, plenty of drawer space; bathroom was very clean, lots of towels, shower stall seemed larger than average and had dispensers on shower wall with body wash, shampoo and conditioner, what a great idea.  My only complaint was that I found the on-site restaurant to be very expensive, however there are lots of restaurants just down the street so we just went to a hibachi place.  Every front desk employee we met was super helpful and friendly.  Hotel is in great location, just off I-95 and it's a quick trip into Boston.  I would stay there again and would highly recommend.  Great location, attentive staff, nice facilities and price is comparable to nearby lesser hotels. Will definitely stay here again   I checked in late so I couldn't enjoy all the amenities the hotel had to offer but I loved the room. Most comfortable bed ever! Staff was friendly and courteous. Very enjoyable experience.   Hotel isn't too far from Gillette stadium, which is where we were coming from. Staff was very friendly, from the front desk to the restaurant. Our room was perfectly clean. There was a slight odor (I couldn't really place it) in the hall, but not in the room. The HVAC and the room was quiet. Not much of a view but the property was nice, clean, and well landscaped. The room was on the small side but it was enough space for my wife and myself. We weren't blown away by the breakfast, but it was nice that they had a large variety. We didn't get a chance to eat in the bistro, as it's not open for breakfast. I would not hesitate to stay here again, or recommend it to anyone in the area.  The curtains in the hotel room do not close to block out the light.  This is insane to me.  I typically don't like when people give a hotel a bad review over one tiny issue, but this issue had just too big of an impact on our stay to ignore.In the summer the sun rises at 6am.  Meaning our room was flooded with daylight at 6am.  The morning after a concert at Gillette stadium.Insane.  The staff was incredible, especially Linda at the Front Desk. Offered tips getting to Gillette then in the morning asked how the concert went... Just added to an already great weekend  The hotel appearance was excellent upon entry. I had a girl help me check in. She was unable to accommodate my request& needed help. The woman who  helped started with NO... This did not impress me. She even just walked away. The young girl still tried and a manager came over, asked me questions about my needs and worked it out...that was customer service! All I needed was my two rooms to be together because we had teenagers with us.  The rooms were close and one was switched to a suite. She even comped us breakfast due to the inconvenience.  We asked for a early check in they made it happen and were more than happy to do it.  We came for a concert. Checked in late. Our room was VERY clean and the bed was a memory foam top. Super comfy. The only issue was the shower head was either trickle or narrow jet stream. Def would stay again. Hotel is beautiful and seems recently upgraded.  Room was neat and clean. Everyone was very polite and pleasant. The Hotel has easy access to the highway.   Pool had very nice renovation, room was very comfortable, clean and updated. Restaurant inside hotel was very good.    ",0.71,0.61,0.29,neg
