,hotelID,TripAdvisor Review,Trip_neg_score,Trip_neut_score,Trip_pos_score,Trip_osat_label,Expedia_User_Comments,Expedia_neg_score,Expedia_neut_score,Expedia_pos_score,Expedia_osat_label
2,8253,"     Artisan Hotel, Las Vegas Reviews Page 9  Clean But Loud The hotel was okay. It was clean, but the air conditioning didn't work properly in our room. Additionally, we were right above a very poorly insulated night club that was hosting latin dance night for about 3 people. I wish I had known this at the time of booking as there was no option for a room in a different part of the hotel. The girl at the desk was snobbish when we asked if they had any rooms away from the club and asked if we would rather check in somewhere else. Thank goodness we were only there for a night.
Room Tip: Ask to be away from the night club.
See more room tips  Great party weekend!!! If you approach this hotel with realistic expectations then you can't go wrong. We really weren't there to sleep. We began with an awesome day at the couples themed pool party. Evolve. If you have visited other Vegas pools you know how hard it can be to get service. Ben and Tommy provided superior service with and outstanding attitude. As well, the crowd itself was super friendly and fun. We didn't get to try any of the night time events due to a concert (NIN) but when we returned to the hotel just after 2am people were still arriving and the place was hoppin. We stayed in room 503 and were very pleased with it. The decor and lighting at this property is dark so my wife did have a lighting problem when it came to getting ready and make-up. There is a lot of outside noise from either the nearby highway or late night parties so be forewarned that sleep may be a little hard..... We expected this per the reviews and like I said, we were here to enjoy the Vegas experience. We really enjoyed our stay at this hotel and our experience with the staff was great.  Mellow summer mid-week stay If you have an odd numbered room on floor 4 or 5 you will have a nice view of the strip. We liked seeing the warehouse district in the foreground and the strip lit up in the background.

Due to the restaurant being closed off and the summer heat the place was empty. The decor is rad. The bar and pool were empty it was easy to score a cabana and chill out. Not much staff around - sort of annoying you have to go to the bar to get ice. The price was amazing $27 and a free bottle of twist top champagne - hilarious and just another $15 for a 3pm check-out.

The rooms are sexy and fun - we would definitely come back.
Room Tip: 5th floor odd numbered
See more room tips  For the hyp and price I expected better. When we arrived we were only greeted by one staff member. It was under construction so the lobby and half of our floor was taped off. The receptionist checking us in wasnt so nice or helpful. No one helped with our bags. When we got to our room, there was a funny smell. The room was tiny compared to what I was expecting for that price or even from the pictures. The toilet paper holder was broken, and they geniusly put the garbage can under it, so when the toilet paper fell, it went into the garbage instead of the floor. We went to the bar and the bartenders looked over us at least twice, then were rude. Music was so loud you couldn't hear a thing. It was very dark at all times. Party lasted long after 7am. Pool had white stuff floating on top and leaves and pines. It was an OK stay but was disappointing in the end.  Trip with friends We rode the MegaBus from Riverside, CA as an adventure trip and chose the Artisan from it website because it looked interesting. I will start with the good features. This is an interesting hotel off the strip. It is an adult only hotel, which was nice. There are works of art on all the walls and ceilings and in the rooms. The hotel is 5 floors. There is a bar and restaurant on site. The rooms are clean and a nice size but the whole place is in dark wood and very dark inside. They have a pool and it is topless (optional) and there were topless women in the pool during our stay. The staff was very friendly and helpful. It was nice just going around looking at all the art. A lot of the art is styled after the Master's of the 17th Century, a lot of nude works of art but very tasteful. The have an adults only channel that comes with the price of the room. Now for the down side. The hotel is right next to the 15 Interstate Highway and the traffic was very loud all night long. The hotel is not well insulated. The restaurant was closed due to a construction accident but it was not stated on the website. The hotel is not within walking distance of anyplace to eat. It is about 1.2 miles from the strip and not easy to get to a bus stop because of the highway and the very busy Sahara Blvd. (The bus system is a Plus) There is a bus stop in front of Palace Station. The bus system is very good in Vegas and it will save you a lot of head aches if you are trying to drive around Vegas and Taxis are not inexpensive in Vegas. The bus system offers a 2 hour pass for $6.00, a 24 hour pass for $8.00 and a 3 day pass for $20.00. The pass is good for any bus in Vegas so you can pretty much go anywhere. That is a plus. The prices for drinks were very high, especially since they are so far from everything else. On Wed, Fri and Sat nights they have music in the bar (DJ) from 10 pm until 4 pm, but the music was so loud we could not stay in the bar. We could not hear the music from our room but our friends who where on the 4th floor stated it was hard to sleep because of the booming bass sounds from the bar. This is probably not a place we would stay again because of the location but it was a fun hotel and it if was not as noisy and more accessible to other places it would be a great place.
Room Tip: If you like loud music, partying and adult themes this is a fun place to give a try.
See more room tips  Party Time and Quality Service Definitely a unique place to stay if you are tired of cookie cutter hotels. Art all over and a very seductive vibe. The whole staff was super courteous and the Management Tara treated us like a close friend she had known for years. Would visit here again to party!  Always a great time at the Artisan Hotel We are a married couple who's youngest child celebrated his 21st birthday in Artisan's best suite a year and a half ago. Who says that you have to be close to 21 years old to enjoy the after hours scene. We love this place and most of the staff. We have always received EXCEPTIONAL service from every aspect of service except for the house keeping staff. Every time we stay longer than 4 days here it seems that whomever is assigned to service our room will ignore the ""Do not disturb"" sign and wake us up REAPEATEDLY. The only maid who has been assigned to our room but has still provided exceptional service is their youngest housekeeper. We don't know her name but she is a short dark haired Latina who always has a smile on her face.

We love the laid back staff and party atmosphere.  GORGEOUS ENTRY, STUNNING LOBBY, MUSIC NEVER ENDS We couldn't wait to book this hotel and we knew it would be different, all the different reviews made it difficult to choose this hotel and off strip always makes it more confusing. Well this is the best review I will give on Trip Advisor so others have an idea of what to expect.

We arrived to a beautiful valet entry of the Artisan Hotel and was amazed of the vegetation, the trees, the whole entry is remarkable. Valet is 4 stars!! very nice, polite and made you feel welcomed every time we returned back from the day.

Entering the lobby it was dark, cozy and has a sexy aura about it. Check in was simple and organized, the male who checked us in was very good but however the front desk clerks beyond that, definately don't make you feel interested in answering any questions you may have about the property or surrounding area and every question seemed to have a undesirable response. I have stayed at Marriotts before with 5 stars customer service, I wasn't expecting that but even the waffle house has an immediate hello and thank you for coming which MAKES customer service your first feeling of how the service will be. So needless to say 2 stars for the front desk.

The room was awesome, seemed to be remodeled, great amenities, awesome view of strip and tiny view of pool but the room was great!! 4 stars for that (Porno station reruns same movie all wknd, c'mon guys).

Now to the lounge/nightclub. Simple, great decor, great patio and interesting. Great place to be with someone or meet someone because it could be real romantic and cozy!!, but the music is sooo damn loud you cannot hear each other and its not geared towards the middle age crowd.The bartenders were really not welcoming and actually seemed annoyed when we tried to spark a conversation or have questions about the property. So 2 stars for that staff.

The Pool is simple, nice and can be relaxing if they played soft top 40's or 70-80's music but the Techno, Thump Thump music at 8am is absolutely REDICULOUS. You party all night whether at the hotel or on the strip and get home at 4 am and I could sleep through the crazy after hours lounge music but when it goes from there to the pool at 8 am everyday!!, music so loud that from the fifth floor I thought the room next door was having a party. It was disgraceful and I have read the reviews on the music and thought I could sleep through it. NEGATIVE. Sunday morning it started up and about an hr later it shut off, It was the best morning I had and that means sleeping!!

The perfect Artisan would be the party stops at 4a.m and the pool music turns on at 11 am, descent pool music not the pounding speaker driven techno music and conversation around the pool would increase and probably also the traffic by more couples. I am probably missing something but I did give it 3 stars!! the property is beautiful, the housekeepers and valet were perfect and made you feel at home, but as my fiancee said,,""I will not come back here because staying out all night we need sleep in the morning and this party music at 8 am doesn't allow us to recoup for the next night out. I understand they only have 3 floors of occupancy so the bar after hours club probably generates a whole lot of money which we both understood, but the hotel environment should not be ruined by the continuous thumping techno around the clock base music. The general manager was very polite and courteous, but its all about the bottom line and in vegas you have to find your niche, but the guest will always return, the young kids partying will always move on.
Room Tip: 5th floor facing strip is beautiful, beware music by after hrs bangs all night and music by pool run...
See more room tips  RE: Pool Closed to SINGLE MALES I still think VERY HIGHLY of this Hotel. Being someone on low salary, I thought this hotel really cares for it guests until I was told I could not use the pool. Be very careful to confirm what you can use in the hotel. I think the pool is one of the coolest in Vegas, but I can't go there.  Beautiful Fun Hotel! My husband and I stayed at the Artisan for a few days in April. It was our 1st anniversary and we wanted something fun and special. We were not disappointed! The lobby of the hotel was breathtaking, the service was fantastic and our room was clean.
Room Tip: We stayed on the 5th floor (room 525). From this room I could not hear the fantastic dance party dow...
See more room tips    ",0.6,0.88,0.4,"""neutral""","Pet friendly - upon arrival room smelled strongly from dog poop.  Had to change.  Breakfast is included but poor quality.Not the best experience...Stay elsewhere.    very centrally located clean staff friendly and helpful  The receptionist was courteous and knowledgeable, the rooms was clean and comfortable.  A good light breakfast was offered in the morning .   The experience was good with a courteous receptionist clean comfortable room and nice breakfast.   Location was great for shopping and restaurants, all within walking distance. Clean and quite. Breakfast buffet was good, but lady working it was not very helpful with guest. The eggs and sausage were served from a different side window and not the buffet table so many like us did not even notice until one guest asked the lady and then lots of people got up and went for eggs. When she served the eggs she just gave everyone eggs and sausage even if they asked for eggs, no smiles no talk I wouldn't say rude , but she just didn't have customer service attitude. Oh and she didn't keep the fruit stocked up. No bananas left despite the fact I could see a box of fruit in the room where she served out of. Otherwise everything else was great.  No issues with stay. I would stay again, should I return.  We hate that place even if at the desk they consent to change our room after  some arguments.  Had a non-smoking room but evidently someone had smoked in it. Had to leave the door open some.   We had a lovely stay in Yarmouth....too brief though!!  Hotel was nice and clean, breakfast not that great and also no pool in the hotel.  Easy access easy parkingGreat accommodating staffNice breakfast each day   Stayed only one night. Breakfast was excellent. Very filling.   We enjoyed our stay in Yarmouth. Hotel is centrally located and was very comfortable.  My boyfriend, myself and my small dog stayed for 3 nights during Nova Scotia music week and were pretty disappointed unfortunately. The first night was great, everything was clean and comfortable. The staff didn't seem to be too friendly at first but throughout the trip they seemed to get better. One of the days I was leaving the room, housekeeping asked if I wanted service. I said yes. I said I wanted the full service and specifically asked for my sheets to be changed. When I got back, the room was okay however the sheets were not changed. The one thing I specifically asked for. They also left cleaning supplies in the bathroom. For the last night, I left my dog in the room while my boyfriend and I went out to enjoy some of the music. Unfortunately the room next to ours was having some kind of a party and it was scaring my dog. When I arrived I gave the hotel my phone number incase anything like that happened so they can call me and I could come tend to her.  They did call, and left a very rude message. ""Come care for your dog, we don't want to have to charge another guests room to your bill due to the disturbance."" The tone, the threat, all of it was unacceptable. I work at a full service hotel myself and know how these situations are supposed to be handled. I immediately came back to the hotel and calmed the situation. I was shocked that I was called about my dog, however the room beside us was still partying by the time we got back. I won't be back.   Breakfast wasn't great but overall a good experience.   Very quick and polite check in. Room very comfortable clean and quiet.  Hotel check-in staff were perfunctory at best, I was left to find my own way to the room through the oddly located (and unsigned) stairwell. The hotel is on the main drag on the way into Yarmouth and despite being surrounded by places, there is basically no pedestrian infrastructure so be prepared to trek across car parks, jaywalk across 3 lanes of traffic, or get back in your car. The breakfast was limited at best, not recommended. Worryingly, the hotel has a sharps policy (for things like syringes(!)) and a no-shirt-no-shoes-no-service policy, which perhaps tells you something of the pitch. The room was clean and the shower decent.  This hotel was in a very convenient location for our family event. Very adequate breakfast and super comfortable bed and pillows (my pet peeve!)   The hotel accommodations were very good. the hotle was only 5 minutes from the ferry terminal. The distance was very convenient for us.IMPORTANT: When I called the hotel directly last Thursday, Aug 27th, I was checking on ""late arrival"" status. They had no reservation for us. When I booked this hotel thru Expedia a month ago, your people or system computers never sent an electronic confirmation to the hotel's computer. Fortunately, they still had a room left for us to book. I called Expedia and they rebooked the reservation for us, since your company goofed big-time. I  won't be booking with Expedia in the future for hotels or flights.Goodbye  Very friendly staff, close to downtown and lots of restaurants and stores within walking distance.  We will definetly go back.  Staff is very nice.  Hotel is dated and musty.  Pet friendly - upon arrival room smelled strongly from dog poop.  Had to change.  Breakfast is included but poor quality.Not the best experience...Stay elsewhere.    very centrally located clean staff friendly and helpful  The receptionist was courteous and knowledgeable, the rooms was clean and comfortable.  A good light breakfast was offered in the morning .   The experience was good with a courteous receptionist clean comfortable room and nice breakfast.   Location was great for shopping and restaurants, all within walking distance. Clean and quite. Breakfast buffet was good, but lady working it was not very helpful with guest. The eggs and sausage were served from a different side window and not the buffet table so many like us did not even notice until one guest asked the lady and then lots of people got up and went for eggs. When she served the eggs she just gave everyone eggs and sausage even if they asked for eggs, no smiles no talk I wouldn't say rude , but she just didn't have customer service attitude. Oh and she didn't keep the fruit stocked up. No bananas left despite the fact I could see a box of fruit in the room where she served out of. Otherwise everything else was great.  No issues with stay. I would stay again, should I return.  We hate that place even if at the desk they consent to change our room after  some arguments.  Had a non-smoking room but evidently someone had smoked in it. Had to leave the door open some.   We had a lovely stay in Yarmouth....too brief though!!  Hotel was nice and clean, breakfast not that great and also no pool in the hotel.  Easy access easy parkingGreat accommodating staffNice breakfast each day   Stayed only one night. Breakfast was excellent. Very filling.   We enjoyed our stay in Yarmouth. Hotel is centrally located and was very comfortable.  My boyfriend, myself and my small dog stayed for 3 nights during Nova Scotia music week and were pretty disappointed unfortunately. The first night was great, everything was clean and comfortable. The staff didn't seem to be too friendly at first but throughout the trip they seemed to get better. One of the days I was leaving the room, housekeeping asked if I wanted service. I said yes. I said I wanted the full service and specifically asked for my sheets to be changed. When I got back, the room was okay however the sheets were not changed. The one thing I specifically asked for. They also left cleaning supplies in the bathroom. For the last night, I left my dog in the room while my boyfriend and I went out to enjoy some of the music. Unfortunately the room next to ours was having some kind of a party and it was scaring my dog. When I arrived I gave the hotel my phone number incase anything like that happened so they can call me and I could come tend to her.  They did call, and left a very rude message. ""Come care for your dog, we don't want to have to charge another guests room to your bill due to the disturbance."" The tone, the threat, all of it was unacceptable. I work at a full service hotel myself and know how these situations are supposed to be handled. I immediately came back to the hotel and calmed the situation. I was shocked that I was called about my dog, however the room beside us was still partying by the time we got back. I won't be back.   Breakfast wasn't great but overall a good experience.   Very quick and polite check in. Room very comfortable clean and quiet.  Hotel check-in staff were perfunctory at best, I was left to find my own way to the room through the oddly located (and unsigned) stairwell. The hotel is on the main drag on the way into Yarmouth and despite being surrounded by places, there is basically no pedestrian infrastructure so be prepared to trek across car parks, jaywalk across 3 lanes of traffic, or get back in your car. The breakfast was limited at best, not recommended. Worryingly, the hotel has a sharps policy (for things like syringes(!)) and a no-shirt-no-shoes-no-service policy, which perhaps tells you something of the pitch. The room was clean and the shower decent.  This hotel was in a very convenient location for our family event. Very adequate breakfast and super comfortable bed and pillows (my pet peeve!)   The hotel accommodations were very good. the hotle was only 5 minutes from the ferry terminal. The distance was very convenient for us.IMPORTANT: When I called the hotel directly last Thursday, Aug 27th, I was checking on ""late arrival"" status. They had no reservation for us. When I booked this hotel thru Expedia a month ago, your people or system computers never sent an electronic confirmation to the hotel's computer. Fortunately, they still had a room left for us to book. I called Expedia and they rebooked the reservation for us, since your company goofed big-time. I  won't be booking with Expedia in the future for hotels or flights.Goodbye  Very friendly staff, close to downtown and lots of restaurants and stores within walking distance.  We will definetly go back.  Staff is very nice.  Hotel is dated and musty.  Pet friendly - upon arrival room smelled strongly from dog poop.  Had to change.  Breakfast is included but poor quality.Not the best experience...Stay elsewhere.    very centrally located clean staff friendly and helpful  The receptionist was courteous and knowledgeable, the rooms was clean and comfortable.  A good light breakfast was offered in the morning .   The experience was good with a courteous receptionist clean comfortable room and nice breakfast.   Location was great for shopping and restaurants, all within walking distance. Clean and quite. Breakfast buffet was good, but lady working it was not very helpful with guest. The eggs and sausage were served from a different side window and not the buffet table so many like us did not even notice until one guest asked the lady and then lots of people got up and went for eggs. When she served the eggs she just gave everyone eggs and sausage even if they asked for eggs, no smiles no talk I wouldn't say rude , but she just didn't have customer service attitude. Oh and she didn't keep the fruit stocked up. No bananas left despite the fact I could see a box of fruit in the room where she served out of. Otherwise everything else was great.  No issues with stay. I would stay again, should I return.  We hate that place even if at the desk they consent to change our room after  some arguments.  Had a non-smoking room but evidently someone had smoked in it. Had to leave the door open some.   We had a lovely stay in Yarmouth....too brief though!!  Hotel was nice and clean, breakfast not that great and also no pool in the hotel.  Easy access easy parkingGreat accommodating staffNice breakfast each day   Stayed only one night. Breakfast was excellent. Very filling.   We enjoyed our stay in Yarmouth. Hotel is centrally located and was very comfortable.  My boyfriend, myself and my small dog stayed for 3 nights during Nova Scotia music week and were pretty disappointed unfortunately. The first night was great, everything was clean and comfortable. The staff didn't seem to be too friendly at first but throughout the trip they seemed to get better. One of the days I was leaving the room, housekeeping asked if I wanted service. I said yes. I said I wanted the full service and specifically asked for my sheets to be changed. When I got back, the room was okay however the sheets were not changed. The one thing I specifically asked for. They also left cleaning supplies in the bathroom. For the last night, I left my dog in the room while my boyfriend and I went out to enjoy some of the music. Unfortunately the room next to ours was having some kind of a party and it was scaring my dog. When I arrived I gave the hotel my phone number incase anything like that happened so they can call me and I could come tend to her.  They did call, and left a very rude message. ""Come care for your dog, we don't want to have to charge another guests room to your bill due to the disturbance."" The tone, the threat, all of it was unacceptable. I work at a full service hotel myself and know how these situations are supposed to be handled. I immediately came back to the hotel and calmed the situation. I was shocked that I was called about my dog, however the room beside us was still partying by the time we got back. I won't be back.   Breakfast wasn't great but overall a good experience.   Very quick and polite check in. Room very comfortable clean and quiet.  Hotel check-in staff were perfunctory at best, I was left to find my own way to the room through the oddly located (and unsigned) stairwell. The hotel is on the main drag on the way into Yarmouth and despite being surrounded by places, there is basically no pedestrian infrastructure so be prepared to trek across car parks, jaywalk across 3 lanes of traffic, or get back in your car. The breakfast was limited at best, not recommended. Worryingly, the hotel has a sharps policy (for things like syringes(!)) and a no-shirt-no-shoes-no-service policy, which perhaps tells you something of the pitch. The room was clean and the shower decent.  This hotel was in a very convenient location for our family event. Very adequate breakfast and super comfortable bed and pillows (my pet peeve!)   The hotel accommodations were very good. the hotle was only 5 minutes from the ferry terminal. The distance was very convenient for us.IMPORTANT: When I called the hotel directly last Thursday, Aug 27th, I was checking on ""late arrival"" status. They had no reservation for us. When I booked this hotel thru Expedia a month ago, your people or system computers never sent an electronic confirmation to the hotel's computer. Fortunately, they still had a room left for us to book. I called Expedia and they rebooked the reservation for us, since your company goofed big-time. I  won't be booking with Expedia in the future for hotels or flights.Goodbye  Very friendly staff, close to downtown and lots of restaurants and stores within walking distance.  We will definetly go back. ",0.61,0.73,0.39,"""neutral"""
