,hotelID,TripAdvisor Review,Trip_neg_score,Trip_neut_score,Trip_pos_score,Trip_osat_label,Expedia_User_Comments,Expedia_neg_score,Expedia_neut_score,Expedia_pos_score,Expedia_osat_label
0,8230,"     Fortune Hotel &amp; Suites, Las Vegas Reviews Page 9  SHOULD NOT BE LISTED The room was filthy.We requested a new room and it was worse.We found hairs on the pillows, in the bed,on the toilet and in the shower.Floors were filthy,blood on pillow cases, and to top it off vomit on the bathroom walls.We didn't stay because it was so disgusting.
Room Tip: Do not stay here.
See more room tips  Horrible, Terrible, the Worst ! The place is the pits. Not sure if this place should even be allowed to stay open. I feel really bad for the front desk staff. The staff had no help and when I asked to speak with a Manager it took 3 days and a guy named Peter was horrible. I am not sure if this manager could manage a paper bag !!!

The rooms are dirty and gross. Sheets and towels stained with holes in them. The housekeeping is horrible and when I asked for my room to be cleaned the poor cleaning lady said the manager Peter again doesn't buy them the supplies they need. I ended up going to Target and buying cleaning supplies to clean the room and gave them to the cleaning lady!

The owner should be ashamed to have a place run like this!
Room Tip: Ask for a room in another hotel ! If you have no choice make them put you in the first building. The...
See more room tips  Great value for money Reading other reviews I just don't know what some people expect. My wife and I paid $80 for 2 nights accom that included wifi, a basic breakfast, shuttle onto the strip and a venue that had a gym pool and jacuzzi. For that price this place was incredible. We were happy to end our night with a kilometre walk back from the strip. It's all flat and we just talked about the shows we had seen.  HOTEL MANGER These pictures aren't any representation of what the ""hotel"" actually is. 1990 TVs non HD. Broken latches in the rooms. Security cards don't even work.This is by far the worst hotel I've stood in and that says a lot. The Travelodge is a better buy than this crap.  Not so bad Didn't have any probs at the hotel, receptionist let me check in early without charge. Yes it's a ten minute walk to the strip but it's not that bad. So ignore the bad reviews and enjoy yourself. Free shuttle to airport is great. Free wifi the whole stay.  Imperial Cornation &amp; Meeting Thank you so Much to Judy &amp; Mark for helping me with this wonderful Event, from helping me book the rooms to letting me cook for my own event you guys are amazing, this hotel is about a mile from the strip, wonderful meeting rooms, wonderful staff we had a great and amazing time!!!!
we will be back
Mary  Photo trickery The first room I was assigned was tucked away under a case of stairs, blocking out any kind of natural light and smelt like it had been hot-boxed with cigarettes for the past 10 years (I am a smoker and it was unbearable). Next room was much better, but I felt the whole hotel had a smell of sour milk, and either those were clumps of dirt stuck in the ac or some kind of horrible herbal insense. The girl at the front desk did not smile once and had a very abrasive attitude and found her over-all attitude was as unwelcoming as the hotel felt.
There is also no bar or alcohol service in the hotel, so not even a chance to settle down and take a breather before you set out for the night.  Poor I did this hotel for 5 nights on a budget and whilst i wasn't expecting the most luxurious hotel in Las Vegas, i wasn't expecting it to be this poor.

My main criticisms are

- The $10 a night 'resort fee', as i didn't use any of it, and lets be honest, if your going to Vegas your not exactly going to be sat in this place for the duration
- The Breakfast was shockingly bad. I expected a better quality of breakfast and breakfast service. Not Polystyrene Cups, and plastic plates and cutlery. What was offered was extremely limited, the coffee was disgusting and i only used it once as i preferred to eat elsewhere
- My room was near the lift, which constantly beeped loudly 24/7, and it was annoying in the extreme when i was trying to get to sleep.
- No apparent security on the site, which meant anyone could gain access at any point during the day. Not ideal when i had valuables in my room.
- I didn't find the reception staff helpful at all, and if i needed anything then often providing customer service seemed like an hinderance.

Personally i would pay a little extra than stay here in the future.
Room Tip: Look elsewhere
See more room tips  Very bad experience I have chosen this hotel because of the free shuttle from / to the airport. I mentioned in my reservation I would arrive after 10h30 pm. I have called over 10 times and no one answered the phone after 10 pm, so I had to pay more for a taxi than for the hotel room.

Night reception was very bad, almost aggressive when I complained about the shuttle.

Rooms are old and ugly (although clean and good bed).

Breakfast is very poor. The worst coffee I have ever had in my life.

Finally, Peter, the manager, could only say he was sorry (and say that the van for the shuttle was stolen in their parking lot - Am I supposed to be sorry or feel insecure???)... so sorry that he turned his back and walked away while I was talking to him. The only nice person was a receptionist called Pahola.

He drove my husband and I to the airport in his personal car (not enough space in the trunk, child seat full of crumbs and children stuff in the floor). So I would NEVER recommend this hotel to a friend.  It's about value OK, so I was stuck in LV for the night having missed the last flt out. I was strictly shopping price on my IPad in the airport and for the sake of a 5 hour stay went with ""cheap"" &amp; close to airport. $26 a night got my attention as did the picture of the lobby staircase. The room was clean, AC was new and quiet, desk clerk friendly/polite. When I inquired about arranging for a cab back to the airport at 5 AM I was advd I could get a hotel provided shuttle...sweet. The driver was prompt and a pleasure to chat with. So this seasoned/well traveled airline retiree considered this brief stay the best deal I could have hoped for. I strongly urge the new owner to continue improving this dated property and justify increasing the room rate.    ",0.58,0.46,0.42,"""neg"""," Hotel was in a good location close to town, had a pretty good breakfast room with lots of choices, clean rooms & nice people. Coffee machine in room didn't work  - just noticed on last day. Very pleased.  Perfect location for being in Birmingham.  The hotel is quite average but the hotel staff is very friendly and helpful. I thought the decor was very nice in its browns and blues and the windows were big and brought in lots of natural light. I watched a beautiful sunset the evening I arrived from my room.  The tub and shower area was very dark because the shower curtain blocked the light, as there was none in the shower itself. The supplied shampoo etc. was nice but came in stupid containers that were hard to get anything out of. One can walk right into Birmingham from the hotel; it's just a block from shopping and restaurants which is very nice.   The staff at the HIE Birmingham, MI are wonderful and poised to help with whatever problem or situation comes up.  I was helped several times a day with small or larger questions, such as ""my password doesn't work."" I got an immediate response and solution.   Nice, within proximity to Birmingham and Bloomfield and the shops and theater. Sits outside the hustle and bustle of the city area.  Trip was great and staff was very helpful with assistance as I was handicap from recent surgery.I enjoyed my stay.Did not like that the cleaning staff smoked in the storage room behind the elevator would be my only negative experience.  Very nice hotel. Friendly staff that was very helpful.  Would stay there again and close to Royal Oak Music theater.    We have stayed at the Holiday Inn in Birmingham before because of the location.  When I booked the room, the description listed the amenities.  One of the amenities was bathrobes and a queen size bed.  When we got to our room, I looked for the bathrobes but there weren't any.  I called the front desk to inquire about the bathrobes and the employee stated they don't have them.  Not that it's a big deal if we had bathrobes, but if the description states certain amenities then they should be provided.  The bed was listed as a queen size but looked more like a full.  We set the temperature in the room at 70.  When the fan came on, the room got extremely warm and when the fan turned off, the room got cold.  Lastly, I know there is a no smoking policy for the rooms, but around 7:15 in the morning, I could smell cigarette smoke coming from somewhere.  On a positive note, the room was clean, we enjoyed the Keurig coffee in the morning and the breakfast was good.  No problems to report, the facility was clean and comfortable, the staff was helpful and friendly.  Been staying in this building as different hotels since 2002 when I think it was a Raddison. It's just that the building itself has reached the end of it's life. The water pressure in the bathroom sink was essentially nonexistant; I ended-up just washing my hands using the bathtub filler which was fine. I called the desk about it, and they said they would look into it, but after 4 days nothing changed. The hotel has had a major front-desk re-do, along with new carpeting and stuff, but it's just not happening overall. The staff was mix of very helpful and very clueless; night and day, literally. The folks on during the day were fine and helpful, and the night not so much (the water-pressure shine-on). What Birmingham needs is a brand new Hampton Inn or similar, but I doubt there's any place to put it. Working on Detroit auto commercials, we used to stay at the Townsend without hesitation, or even this place back when it was the Raddison. But now that most economic factors are much lower than they were in the ""good old days"", ad budgets no longer afford the Townsend - and this place seems to have slipped a few more places in the last 4 years even with the re-do. It's location is unbeatable if you have business in Birmingham, except for the Townsend of course. It's just too bad that you leave hoping you won't need to come back. The TV service if still hovering around 1983 I'd say. All in all, if you're there just to take care of business and absolutely nothing else, it's fine.  The room was big and the bathroom nicely outfitted - marble and cushy towels. The pillows were comfortable and the beds were great. The breakfast is amazing. Great coffee, warm cinnamon rolls, nice omelets and fruit. Wow - really upscale for a HIE. You will love it.   Everything was great but our AC in the room did not work.  This hotel was the perfect choice for our trip. We needed to be close to Beaumont Hospital and it was only blocks away and easy to find.  It was close to resaurants, grocery store, Fed.Ex for mailing and copies, Starbucks - although the coffee provided by HIE was very good, and much more.  The beds were so very comfortable and the employees were all helpful and friendly and very professional.  The only drawback is the printer in the business center did not work very well, so we couldn't print our boarding passes.... better you make other arrangements.All around a great experience.    Nice and clean.  Easy to get too.  Staff was helpful and friendly.    Clean and quiet. OK breakfast with meal. By Chicago standards in walking distance to all of Birmingham amenities   The staff at this hotel were awesome, my only complaint would be that the heater was loud while we were sleeping.  The staff were pleasant. The breakfast was good. Parking was convenient with 6 to 8 covered parking spots. One negative would be that it took a while to get hot water in our shower, you had to run the water for a few minutes before it warmed. The small double bed should be replaced with queen or king size beds.  old and tied decore, Breakfast food horrible. don't have any further to say.  In town for a funeral so it was adequate. Room was clean and the beds were comfortable. Lobby area was quite small. Staff were pleasant.  This hotel is undergoing a facelift.  Our room was fully updated and beautiful.  There were some common areas awaiting updating.  The staff was friendly and helpful.  The breakfast included more than the typical free continental breakfast.  Very nice stay..  room was clean, very large, bed was comfortable.  The bathroom was large, good shower.  VERY convenient to downtown Birmingham.  Nice that breakfast was included, too!  They are working on updating the hotel now too so it will, presumably, be even more updated in the near future.  My daughter and I spent 1 night here to attend Il Divo concert. Would return in the future.  very nice and friendly staff. i highly recommend if staying in the area.   I had my doubts at first, but then I came in everything was very nice and clean and organized. The hotel staff was very nice even made me laugh. Trust me I dont laugh much but they sure made me laugh. Asked for a few extra towels and they brought it up within two minutes. On the second day, I knew the hotel staff was going to clean up my room so i worried about my things. But when i got back. Everything was still there wish a very clean room. Thanks you very much.   The air conditioner in each room was absolutely filthy. The showers could have been cleaner. The elevator would jump either when you stepped on or got off. Mildly sketchy. Breakfast was ok... Other than that the rest of the property was fine. The bathroom was spacious.   I spent a week here for a job nearby and the hotel was good, rooms are clean, you get 4 pillows per bed (my room was double queen) i onky needed one bed, but it was a plus to have extra room to place clothes etc. The pillows are labeled firm and soft.  Nice touch! No more trying to figure what pillows I like.  I am giving feedback from clients that have traveled and stayed at your hotel.  They are there for corporate travel and are very happy.   Got in late and got to sleep late. Very quiet and breakfast went late  The room was neat and clean.  No frills, king bed, desk with chair and side chair.  Clean Bathroom.  View of the Waterpark across the street, it is off season so no crowds or traffic.  The staff was very friendly.  clean hotel, friendly staff. Close to few places to eat.  All good normal holiday inn staff helpful no problems   Asked for a fan several days before the stay. Fan was already in the room waiting. Asked for a complimentary additional hour before check out and it was not a problem.   Just stayed for night. Great front desk clerk. Nice breakfast. Great water park right across street.  This hotel was exactly what we were looking for-proximity to Dorney Park and clean and comfortable. Our whole family of five was impressed with the cleanliness of the room and the amenities. From the staff to the service, everything was great. This will be the place we choose again if we stay in the area.  I had a wonderful time. The peace and solitude I received during my stay at the hotel were unmatched.   We stayed 3 night at this hotel, very comfortable pillows, they offered coffee and tea around the clock and in August they had pancakes from 8-12 every night, all the staff were very nice, when we checked in Sunday evening one of our room keys didn't work the manager bought up a replacement key to us.  Stay was ok, been at better places, also been to worse   Good place to stay enjoyed the experience, clean,  new and well kept  Comp. breakfast and distance from Dorney Park.(across the street and walking distance). Good value for the price.  We arrived at the hotel a little early around 9:30 am. The receptionist was super nice to let us check in early so we can go to the park. She also offered us breakfast to save us time so my kids can go to Dorney Park when it opens. Room are clean, staffs are super nice & friendly, breakfast are delicious, location is very convenient. I give it 5 star overall. Would definitely recommend to others.  Nice hotel, we enjoyed our stay. Conveniently located right across the street from Doney Park.   Hotel was in a good location close to town, had a pretty good breakfast room with lots of choices, clean rooms & nice people. Coffee machine in room didn't work  - just noticed on last day. Very pleased.  Perfect location for being in Birmingham.  The hotel is quite average but the hotel staff is very friendly and helpful. I thought the decor was very nice in its browns and blues and the windows were big and brought in lots of natural light. I watched a beautiful sunset the evening I arrived from my room.  The tub and shower area was very dark because the shower curtain blocked the light, as there was none in the shower itself. The supplied shampoo etc. was nice but came in stupid containers that were hard to get anything out of. One can walk right into Birmingham from the hotel; it's just a block from shopping and restaurants which is very nice.   The staff at the HIE Birmingham, MI are wonderful and poised to help with whatever problem or situation comes up.  I was helped several times a day with small or larger questions, such as ""my password doesn't work."" I got an immediate response and solution.   Nice, within proximity to Birmingham and Bloomfield and the shops and theater. Sits outside the hustle and bustle of the city area.  Trip was great and staff was very helpful with assistance as I was handicap from recent surgery.I enjoyed my stay.Did not like that the cleaning staff smoked in the storage room behind the elevator would be my only negative experience.  Very nice hotel. Friendly staff that was very helpful.  Would stay there again and close to Royal Oak Music theater.    We have stayed at the Holiday Inn in Birmingham before because of the location.  When I booked the room, the description listed the amenities.  One of the amenities was bathrobes and a queen size bed.  When we got to our room, I looked for the bathrobes but there weren't any.  I called the front desk to inquire about the bathrobes and the employee stated they don't have them.  Not that it's a big deal if we had bathrobes, but if the description states certain amenities then they should be provided.  The bed was listed as a queen size but looked more like a full.  We set the temperature in the room at 70.  When the fan came on, the room got extremely warm and when the fan turned off, the room got cold.  Lastly, I know there is a no smoking policy for the rooms, but around 7:15 in the morning, I could smell cigarette smoke coming from somewhere.  On a positive note, the room was clean, we enjoyed the Keurig coffee in the morning and the breakfast was good.  No problems to report, the facility was clean and comfortable, the staff was helpful and friendly.  Been staying in this building as different hotels since 2002 when I think it was a Raddison. It's just that the building itself has reached the end of it's life. The water pressure in the bathroom sink was essentially nonexistant; I ended-up just washing my hands using the bathtub filler which was fine. I called the desk about it, and they said they would look into it, but after 4 days nothing changed. The hotel has had a major front-desk re-do, along with new carpeting and stuff, but it's just not happening overall. The staff was mix of very helpful and very clueless; night and day, literally. The folks on during the day were fine and helpful, and the night not so much (the water-pressure shine-on). What Birmingham needs is a brand new Hampton Inn or similar, but I doubt there's any place to put it. Working on Detroit auto commercials, we used to stay at the Townsend without hesitation, or even this place back when it was the Raddison. But now that most economic factors are much lower than they were in the ""good old days"", ad budgets no longer afford the Townsend - and this place seems to have slipped a few more places in the last 4 years even with the re-do. It's location is unbeatable if you have business in Birmingham, except for the Townsend of course. It's just too bad that you leave hoping you won't need to come back. The TV service if still hovering around 1983 I'd say. All in all, if you're there just to take care of business and absolutely nothing else, it's fine.  The room was big and the bathroom nicely outfitted - marble and cushy towels. The pillows were comfortable and the beds were great. The breakfast is amazing. Great coffee, warm cinnamon rolls, nice omelets and fruit. Wow - really upscale for a HIE. You will love it.   Everything was great but our AC in the room did not work.  This hotel was the perfect choice for our trip. We needed to be close to Beaumont Hospital and it was only blocks away and easy to find.  It was close to resaurants, grocery store, Fed.Ex for mailing and copies, Starbucks - although the coffee provided by HIE was very good, and much more.  The beds were so very comfortable and the employees were all helpful and friendly and very professional.  The only drawback is the printer in the business center did not work very well, so we couldn't print our boarding passes.... better you make other arrangements.All around a great experience.    Nice and clean.  Easy to get too.  Staff was helpful and friendly.    Clean and quiet. OK breakfast with meal. By Chicago standards in walking distance to all of Birmingham amenities   The staff at this hotel were awesome, my only complaint would be that the heater was loud while we were sleeping.  The staff were pleasant. The breakfast was good. Parking was convenient with 6 to 8 covered parking spots. One negative would be that it took a while to get hot water in our shower, you had to run the water for a few minutes before it warmed. The small double bed should be replaced with queen or king size beds.  old and tied decore, Breakfast food horrible. don't have any further to say.  In town for a funeral so it was adequate. Room was clean and the beds were comfortable. Lobby area was quite small. Staff were pleasant.  This hotel is undergoing a facelift.  Our room was fully updated and beautiful.  There were some common areas awaiting updating.  The staff was friendly and helpful.  The breakfast included more than the typical free continental breakfast.  Very nice stay..  room was clean, very large, bed was comfortable.  The bathroom was large, good shower.  VERY convenient to downtown Birmingham.  Nice that breakfast was included, too!  They are working on updating the hotel now too so it will, presumably, be even more updated in the near future.  My daughter and I spent 1 night here to attend Il Divo concert. Would return in the future.  very nice and friendly staff. i highly recommend if staying in the area.   I had my doubts at first, but then I came in everything was very nice and clean and organized. The hotel staff was very nice even made me laugh. Trust me I dont laugh much but they sure made me laugh. Asked for a few extra towels and they brought it up within two minutes. On the second day, I knew the hotel staff was going to clean up my room so i worried about my things. But when i got back. Everything was still there wish a very clean room. Thanks you very much.   The air conditioner in each room was absolutely filthy. The showers could have been cleaner. The elevator would jump either when you stepped on or got off. Mildly sketchy. Breakfast was ok... Other than that the rest of the property was fine. The bathroom was spacious.   I spent a week here for a job nearby and the hotel was good, rooms are clean, you get 4 pillows per bed (my room was double queen) i onky needed one bed, but it was a plus to have extra room to place clothes etc. The pillows are labeled firm and soft.  Nice touch! No more trying to figure what pillows I like.  I am giving feedback from clients that have traveled and stayed at your hotel.  They are there for corporate travel and are very happy.   Got in late and got to sleep late. Very quiet and breakfast went late  The room was neat and clean.  No frills, king bed, desk with chair and side chair.  Clean Bathroom.  View of the Waterpark across the street, it is off season so no crowds or traffic.  The staff was very friendly.  clean hotel, friendly staff. Close to few places to eat.  All good normal holiday inn staff helpful no problems   Asked for a fan several days before the stay. Fan was already in the room waiting. Asked for a complimentary additional hour before check out and it was not a problem.   Just stayed for night. Great front desk clerk. Nice breakfast. Great water park right across street.  This hotel was exactly what we were looking for-proximity to Dorney Park and clean and comfortable. Our whole family of five was impressed with the cleanliness of the room and the amenities. From the staff to the service, everything was great. This will be the place we choose again if we stay in the area.  I had a wonderful time. The peace and solitude I received during my stay at the hotel were unmatched.   We stayed 3 night at this hotel, very comfortable pillows, they offered coffee and tea around the clock and in August they had pancakes from 8-12 every night, all the staff were very nice, when we checked in Sunday evening one of our room keys didn't work the manager bought up a replacement key to us.  Stay was ok, been at better places, also been to worse   Good place to stay enjoyed the experience, clean,  new and well kept  Comp. breakfast and distance from Dorney Park.(across the street and walking distance). Good value for the price.  We arrived at the hotel a little early around 9:30 am. The receptionist was super nice to let us check in early so we can go to the park. She also offered us breakfast to save us time so my kids can go to Dorney Park when it opens. Room are clean, staffs are super nice & friendly, breakfast are delicious, location is very convenient. I give it 5 star overall. Would definitely recommend to others.  Nice hotel, we enjoyed our stay. Conveniently located right across the street from Doney Park.   My daughter and I spent 1 night here to attend Il Divo concert. Would return in the future.  very nice and friendly staff. i highly recommend if staying in the area.   I had my doubts at first, but then I came in everything was very nice and clean and organized. The hotel staff was very nice even made me laugh. Trust me I dont laugh much but they sure made me laugh. Asked for a few extra towels and they brought it up within two minutes. On the second day, I knew the hotel staff was going to clean up my room so i worried about my things. But when i got back. Everything was still there wish a very clean room. Thanks you very much.   The air conditioner in each room was absolutely filthy. The showers could have been cleaner. The elevator would jump either when you stepped on or got off. Mildly sketchy. Breakfast was ok... Other than that the rest of the property was fine. The bathroom was spacious.   I spent a week here for a job nearby and the hotel was good, rooms are clean, you get 4 pillows per bed (my room was double queen) i onky needed one bed, but it was a plus to have extra room to place clothes etc. The pillows are labeled firm and soft.  Nice touch! No more trying to figure what pillows I like.  I am giving feedback from clients that have traveled and stayed at your hotel.  They are there for corporate travel and are very happy.   Got in late and got to sleep late. Very quiet and breakfast went late  The room was neat and clean.  No frills, king bed, desk with chair and side chair.  Clean Bathroom.  View of the Waterpark across the street, it is off season so no crowds or traffic.  The staff was very friendly.  clean hotel, friendly staff. Close to few places to eat.  All good normal holiday inn staff helpful no problems   Asked for a fan several days before the stay. Fan was already in the room waiting. Asked for a complimentary additional hour before check out and it was not a problem.   Just stayed for night. Great front desk clerk. Nice breakfast. Great water park right across street.  This hotel was exactly what we were looking for-proximity to Dorney Park and clean and comfortable. Our whole family of five was impressed with the cleanliness of the room and the amenities. From the staff to the service, everything was great. This will be the place we choose again if we stay in the area.  I had a wonderful time. The peace and solitude I received during my stay at the hotel were unmatched.   We stayed 3 night at this hotel, very comfortable pillows, they offered coffee and tea around the clock and in August they had pancakes from 8-12 every night, all the staff were very nice, when we checked in Sunday evening one of our room keys didn't work the manager bought up a replacement key to us.  Stay was ok, been at better places, also been to worse   Good place to stay enjoyed the experience, clean,  new and well kept  Comp. breakfast and distance from Dorney Park.(across the street and walking distance). Good value for the price.  We arrived at the hotel a little early around 9:30 am. The receptionist was super nice to let us check in early so we can go to the park. She also offered us breakfast to save us time so my kids can go to Dorney Park when it opens. Room are clean, staffs are super nice & friendly, breakfast are delicious, location is very convenient. I give it 5 star overall. Would definitely recommend to others.  Nice hotel, we enjoyed our stay. Conveniently located right across the street from Doney Park.  ",0.57,0.72,0.43,"""neutral"""
