,hotelID,TripAdvisor Review,Trip_neg_score,Trip_neut_score,Trip_pos_score,Trip_osat_label,Expedia_User_Comments,Expedia_neg_score,Expedia_neut_score,Expedia_pos_score,Expedia_osat_label
7,8745,"     Holiday Inn Express Las Vegas South Hotel Reviews Page 9  Very pleasant Oct. 05 to 12 2013 The staff is very friendly and made you feel very welcome. The hotel upgraded us and it was a very nice room. They had a shuttle that took us to the strip and shopping. The only thing that would of been nice if they picked you up from the airport. The breakfast was good that was supplied. The hot tub was broken which was not fixed during our stay.
Room Tip: The area where the hotel is quiet but you are not on the strip you are about 10 minutes away by car.
See more room tips  Location, Location Pros: The HIE is close to the airport and close to LV attractions. They provide shuttle service to Mandalay Bay and New York  New York so you can get within walking distance to most of the casinos. The shuttle (common to the hotels in the immediate area) also can be reserved for a return to the airport. The rooms are standard HIE offerings  nothing special.
Cons: There is no shuttle service from the airport. Be prepared to take a taxi (about $15 plus tip). If you pick up a rental car you must take a bus from the terminal to the transportation center. If you are not familiar with the area, make sure you download directions.  Nice Stay This is a good place to stay on the fly when visiting in Las Vegas. They have a shuttle that will take you to the Mandalay Bay or New York New York. The shuttle is great! No having to get in the car and find parking if you want to walk the strip. Rooms are clean but be advise that there is no ice machine on the third floor. I found this out after walking the length of the third floor in socks only to get my feet wet as the carpet was soaked from those who were using the pool. After finding no ice machine in the usual places I had to go to the first floor to find the ice machine!
Room Tip: Be sure to get your ice before heading to your room if you are on the third floor. No Ice machine on...
See more room tips  Good Value Overnight stay, the location is off the strip but the hotel does offer a shuttle to the Mandalay Bay Convention Center, and New York Casino until 1 AM. They also have a morning Airport drop off shuttle. The taxi fare from the airport is about $25 to $30 one way. The room was clean and the hotel was fairly new. They offer free in room wifi and a good breakfast. The only problems we had were: didn't receive our wake up call, and they hadn't scheduled our morning airport shuttle, which we requested the night before. They were able to gets us on a shuttle that morning on time. I would stay here again.  Good value for trip to Las Vegas We spent one night here during a weekend trip to Las Vegas with friends.
The room was spacious and there was free wifi, but unfortunately no fridge. I believe they were available at a charge, but think this is disappointing for a Vegas location.
The bed was huge and comfortable, although the room looked slightly tired, probably just due to the age of the building. It was certainly clean and only the lack of fridge would stop me staying there again.
We didn't get a chance to try out the pool area, unfortunately.
Thoroughly enjoyed the free breakfast! Lots to choose from, including hot items, toast, bagels, muffins, jams etc. The orange juice in particular was lovely. What brand is it!
Well located, and there was also a shuttle bus, though I can't remember which big casino places it stopped at.
Free parking included, which is a bonus, and the staff were really helpful.  Very, very average hotel with great customer service This place was a very basic hotel, and that isn't saying much in Vegas. The customer service was exceptional, however, and it was very clean, so not bad if you are looking for an inexpensive off-strip hotel. I got my dad a junior suite for two nights and when we went to check him in the room was spacious and very clean. However the bed was quite large for the two small pillows on it and that looked a bit strange. The view from the window was almost totally blocked by the external part of the building. The strangest bit, perhaps, was that the clock radio looked very new, as did the rest of the building, but it played CDs and had no hook-up for MP3 players. Who travels with CDs anymore? I mean that's not essential, but the thing was huge and I just can't figure out why you would bother with such a massive, new piece of kit that very few people would use in this day and age. The pool was small and next to the parking lot, but blocked off by privacy fencing and very clean; we took my daughter swimming in it and it's good for kids. My dad said the breakfast was abysmal and he's not too picky, but I didn't see it first hand. Overall, if you're going for a short stay and don't want to be on the strip or are going for business on a budget, this is an ok place, mostly because the people working there were so incredibly nice, welcoming and accommodating at every chance to be so.  weekend get away this is a very clean hotel great customer service friendly staff the rooms were very nice had a great nights sleep wonderful bed very comfortable. they had a good breakfast a wide choise .only a cross the freeway from the strip. lots of parking nice work out room.  Great value and location I was so happy that we were NOT staying on the strip. This is just off the strip without all the noise and people. They have a free shuttle that will take you down but we did not have any problem driving ourselves and parking at the various hotels/casinos.

The beds were comfortable and the rooms were clean. You do hear the airport noise but it didn't bother me. The breakfast is why I love to stay at Holiday Inns. Love it!

Staff were super friendly
Room Tip: Stay on the second floor if you want to do your own laundry. That is where you will find the very re...
See more room tips  Needs some work! Pleasant staff, especially at the morning breakfast buffet, but this hotel is definitely showing it's age. Ladder up for days in the lobby with wires hanging down. Cable TV service went out and they made it sound like Cox didn't even want to respond. Thermostat broken in the room so you had to control the AC at the unit with choice of blast or bigger blast - so without a thermostat you'd wake up around 2AM freezing. But the worst thing was the room REEKED of cigarette smell and when I complained about it at the desk when checking out the reply was ""oh, you're right below the smoking wing and it comes through the vents"" - if you know what the problem is FIX IT, my room was a non-smoking room!
Room Tip: If your room is on the third floor, west side and you don't smoke CHANGE your room - the smell o...
See more room tips  Love this place! Great location, nice rooms, easy parking, good breakfast, friendly staff, nice price. What else is there to say?

The access to the Strip and I-15 is easy. Been staying here for over 6 years on LV trips.

Recommended!    ",0.51,0.95,0.49,"""neutral"""," Good location right off Metro at Grands Blvd Station. Lots of restaurants and theatres nearby. Room is 3 stars. Service is ok. Good for simple travellers who are not picky and want to experience local Paris city life.   First night we arrived was greeted by receptionist. All went well and then I entered our room. The overwhelming smell of stale food hit us like a brick. After phoning down to see if this was a smoking room as it had a balcony I was rudely hung up on. Then a phone call from reception at 2330 to see if it was us In that room. First impressions were bad and it was only going to get worse. I read about soundproofed rooms. I wish. We were kept up all night with the goings on of our active neighbours. But a new day had come and as my wife showered she described it as being peed on from a height. I was next in the shower and soon found out that the shower head was embedded in dirt and grime. Which I had to clean. A great start to the day. as we were in a hotel that we didn't know we put our stuff In the safe and headed out and lastly put a do not disturb sign on the door. When we came back from a lovely day the sign had been taken off and the room had been entered. Ok no harm done some may say. I do not. By then we had new neighbours who were a rather large family and instead of giving them rooms next to each other they placed them at different places on our floor. So another disturbed night of children running in the corridors and doors slamming all night and early morning. The next morning we went out and as we had not had a proper sleep yet we returned mid afternoon to go for a nap. Again the maids presented themselves to the do not disturb sign by entering the room. Don't stay.   Good hotel generally, room small but adequate pity there is no sound proofing from adjacent rooms. Bathroom had been recently refurbished & was super.   The beds were heavenly and the location was great, however, the rooms were for very small.  Reception staff were extremely helpful. However our bedroom was fairly dark and the lighting within was poor.The bathroom was spacious, clean and light but towels a bit thin and towel rails were totally inadequate and shampoos a bit sparse. Breakfast buffet was limited as far as any hot dishes swede concerned but there was a good selection of pastries. Very handy for the Metro with a station just 30 metres from the entrance, however we could hear the rumble of the trains within our bedroom.  Room too small. Mattress past its life. Room not serviced. Breakfast paid for but supplies lacking.  Booked 3 rooms for 2 nights on a business trip. My room was great, slightly thin walls on one colleagues' room but otherwise great, aircon not working on the third room. This was reported and ignored twice and I think it was a big problem with other guests too. It is often the case in Paris, where the aircon is temperamental.Not helpful in 35 degree heat though. Would book again despite the hiccup.  the hotel is very shabby - old and in desperate need of a remodel - room was very hot - air conditioner hardly worked and no sheet on the bed - just a duvet so couldnt use it as it was too hot. the staff were great and very accomdating and the location was great but would not stay again due to the rooms being so uncomfortable.  Rubbish - it is difficult to find and when you do the rooms are too small (not just my experience), the staff miserable and it is pricy.  We had a superior room and had an excellent stay. The bed was comfy and the large French windows made the room airy. The shower was good and the room was very clean. Good location, near plenty of cafe's and the metro.   although it was my business trip I really did enjoy the stay here at Best Western Ronceray Opera. Eating, shopping, transportation, sight seeing, everything was possible due to a great location.  Very central and easy to get around  .  The main problem was in finding the hotel, the entrance being hidden along a small arcade.  It would help to know that it is next to the Gifren waxworks museum in arcade Jouffrey.    Very clean and comfortable. Really close to most tourist attractions. Easy to get to from the airport. Recommended!  The staff was pleasant and helpful. The rooms were very nice and clean with a large bathroom.  This Hotel is in renovation works for more than one year.No improvements can be seen. Dirty floors, cleaning of the room very disapointing, mattress from the 19th century for shure, WI-FI not working. Public areas of the Hotel, like the bar, are rented for private activities. Only one lift for the hole hotel, staff use it all morning,so it's almost impossible to get it.I will never return. I will not recommend this Hotel.  not very pleasant they gave me the worst room... internet was off... however the staff offered that I use their office, the stay was not up to my expectation  Staff was welcoming and nice. Changed our rooms due to me being tall and shower height being small. Breakfast in the morning was good...time and money saver... Size of room was good.  You get what you pay for... Plenty of restaurants within walking distance and the Metro station (100m or so) can connect you to any place in Paris.   The hotel is situated on a fairly lively street full of good bars and restaurants (bring plenty of money if you're planning to drink!).  We checked in fairly smoothly and found our room had an incredible view of Sacre Coeur.  Might be worth requesting a room on at least the second floor and facing away from the front street to be sure of that view.  The room itself was clean, though a little on the small side - shouldn't be an issue as you're not going to be staying in there long with all of Paris to explore.  Overall, I thoroughly enjoyed my stay.  Booked through yourselves on the day , but when we arrived they said they didn't know anything about it , as ""our emails were down.""    .........as a result they gave us a room with no air conditioning (presumably as they hadn't let it out as it wasn't up to scratch)..... was way too hot for 2 nights.  This hotel is wonderful! It has a cute, historical-French, comfortable decor in the rooms and lobby. I loved the lace window curtains and pretty, flowered bedspread. The bathroom was modern -- with a tub, too! Everything was spotlessly clean, and the bed was great for good sleeping. The front desk staff and housekeeping staff were exceptionally friendly and helpful. The hotel also has a casual cafe and a regular restaurant with breathtaking views from its outdoor and indoor seating. The food at both places was delicious! I really enjoyed my stay, and highly recommend this hotel.   Extremely helpful staff, perfect location, free parking in front of hotel.  Fast check in and check out. Excellent valet who is skilled at moving cars around in their tiny car park lot. Did not try the restaurant due to many many places to eat steps from the hotel but breakfast is offered. very close to the Cite Reilgieuse. Overall, I would stay again.   It is not the hotel's fault that it is so hard to park, but it doesn't help that the hotel is located in the middle of a pedestrian zone. You can drive your car there to leave with a valet, but no one tells you that so you arrive wondering where is my hotel and how many more hours must I look for parking. No exaggeration. The hotel should make an effort to inform guests of this problem. As for the hotel itself, the beds are really comfortable and the room clean. If I were to go back I might try the other big hotel, but I imagine neither is a draw in itself.  Nice location in the middle of the old town. The restaurant was very good. Lovely little place.  Fabulous hotel, almost a boutique hotel, perched on the side of Rocamodur with views of the valley.  There is a gracious and traditional French restaurant with windows on the valley side.  A small, friendly bar with a local aperitif, omelettes, burgers, and beer fronts the street side.  In season, a perfectly situated terrace, and for the lucky few, parking!  The staff was friendly, helpful, and kind regarding my extremely poor French.  Couldn't find a better location in Rocamadour - and with car parking!Friendly, helpful staff, excellent restaurant.   The hotel is about as central as you can get, to the point that it is difficult to weave through the pedestrian crowds to get to it. Location is everything but the rooms were very nice. The restaurant was good but not as good as it thinks and we had better value meals and better service elsewhere.  What a wonderful hotel. Right in the heart of Rocamadour. We parked right outside the hotel, the staff came out to greet us. They offered us a choice of 2wonderful rooms, both of which were lovely. I stay in a lot of hotels, but this one was exceptional for its location, great staff and the most comfiest bed!I can't wait to return to Racamadour and wouldn't hesitate to stay at the Best Western.Didn't have breakfast or dinner there but the restaursnt and bar looked lovely with a good menu.  We stayed at the walled mideaval city of Rrocamadour. This hotel almost transported back to the times of 13th century France. Hard to explain the location, the views and cliffs. The narrow walls of a city well preserved from the times that surrounds it. The food was amazing and so was the sights and sounds  The hotel staff was very friendly and helpful. Parking was a major relief given the very tight fit and rather stressful arrival to the hotel location. The dinner at the hotel restaurant was first rate and the view was fabulous. Breakfast was convenient and offered an ample variety.  What a lovely hotel in a superb spot - as you drive around the gorge on the bendy road, you suddenly see the village clinging to the cliff, with with its turrets and towers and the ancient stone entrance arch that doesn't look big enough to drive your car through, but you can, then down the narrow cobbled street and then you see your hotel. The hotel is in 2 parts - the very old part, where you find reception is on the right all dark wood and tapestries. The car park is on the right on the other side of the road, next to the restaurant, bar and bedrooms. We had taken our cat Elvis with us (long story!) and the hotel were happy to accommodate pets in the room. The hotel room was in the roof of the new building - really warm, cosy and modern with wooden beams, and a patio door to look down over the gorge with great views. The room had a hairdryer,TV (BBC), a huge comfortable bed, bath and shower. No coffee making facilities but a good bar and restaurant downstairs. We ate the 26 Euro 3 course meal at the restaurant overlooking the gorge, which was excellent. The food was cooked to perfection with big portions. I couldn't fault this hotel in any way - the staff were helpful and friendly and spoke English, the rooms were good, as was the food and the location is absolutely magical.  Nice staff, perfect location, good breakfast. All that for a great price.  Excellent reception, large room, great view, best retaurant in Rocamadour, quiet A/C that really worked. Verry good parking and excellent location in the centre.  Rocamadour, a three star attraction, is perched on the side of a rock clift valley so that the hotels and restaurants have rather spectacular views. It is a busy tourist center so arrive late in the day when the street (just one) is less crowded but the shops, restaurants and historic sights are still open.  Great location with stunning views from rooms in the extension over the restaurant. Our room was over the street side but no noise or distraction from a good sleep. Good aircon in rooms and all public areas. Menu in restaurant. We stayed one night in June, I imagine it could be a lot busier in peak season. Good hotel. Really pleased with the booking and service.  Hotel was fine. Attached restaurant served good meals and a great view of the valley. Breakfast buffet at 11E turned out to be a bargain. Maitre d' recommended good local wines with dinner. Service in hotel and restaurant was a little slow but friendly. Parking across the street was included and was extremely convenient.  hotel was in one of the most beutifull spots in france with beatifull views from both rooms of the valley and of the medival village that surrounds you.Exellent host at hotel . wonderfull experince , so wonderfull we couldnt leave straight away and so stayed another night.fully recomend to all.  hard to better for its location  Friendly helpful staff, wonderful restaurant, good clean rooms.  This hotel is wonderful! It has a cute, historical-French, comfortable decor in the rooms and lobby. I loved the lace window curtains and pretty, flowered bedspread. The bathroom was modern -- with a tub, too! Everything was spotlessly clean, and the bed was great for good sleeping. The front desk staff and housekeeping staff were exceptionally friendly and helpful. The hotel also has a casual cafe and a regular restaurant with breathtaking views from its outdoor and indoor seating. The food at both places was delicious! I really enjoyed my stay, and highly recommend this hotel.   Extremely helpful staff, perfect location, free parking in front of hotel.  Fast check in and check out. Excellent valet who is skilled at moving cars around in their tiny car park lot. Did not try the restaurant due to many many places to eat steps from the hotel but breakfast is offered. very close to the Cite Reilgieuse. Overall, I would stay again.   It is not the hotel's fault that it is so hard to park, but it doesn't help that the hotel is located in the middle of a pedestrian zone. You can drive your car there to leave with a valet, but no one tells you that so you arrive wondering where is my hotel and how many more hours must I look for parking. No exaggeration. The hotel should make an effort to inform guests of this problem. As for the hotel itself, the beds are really comfortable and the room clean. If I were to go back I might try the other big hotel, but I imagine neither is a draw in itself.  Nice location in the middle of the old town. The restaurant was very good. Lovely little place.  Fabulous hotel, almost a boutique hotel, perched on the side of Rocamodur with views of the valley.  There is a gracious and traditional French restaurant with windows on the valley side.  A small, friendly bar with a local aperitif, omelettes, burgers, and beer fronts the street side.  In season, a perfectly situated terrace, and for the lucky few, parking!  The staff was friendly, helpful, and kind regarding my extremely poor French.  Couldn't find a better location in Rocamadour - and with car parking!Friendly, helpful staff, excellent restaurant.   The hotel is about as central as you can get, to the point that it is difficult to weave through the pedestrian crowds to get to it. Location is everything but the rooms were very nice. The restaurant was good but not as good as it thinks and we had better value meals and better service elsewhere.  What a wonderful hotel. Right in the heart of Rocamadour. We parked right outside the hotel, the staff came out to greet us. They offered us a choice of 2wonderful rooms, both of which were lovely. I stay in a lot of hotels, but this one was exceptional for its location, great staff and the most comfiest bed!I can't wait to return to Racamadour and wouldn't hesitate to stay at the Best Western.Didn't have breakfast or dinner there but the restaursnt and bar looked lovely with a good menu.  We stayed at the walled mideaval city of Rrocamadour. This hotel almost transported back to the times of 13th century France. Hard to explain the location, the views and cliffs. The narrow walls of a city well preserved from the times that surrounds it. The food was amazing and so was the sights and sounds  The hotel staff was very friendly and helpful. Parking was a major relief given the very tight fit and rather stressful arrival to the hotel location. The dinner at the hotel restaurant was first rate and the view was fabulous. Breakfast was convenient and offered an ample variety.  What a lovely hotel in a superb spot - as you drive around the gorge on the bendy road, you suddenly see the village clinging to the cliff, with with its turrets and towers and the ancient stone entrance arch that doesn't look big enough to drive your car through, but you can, then down the narrow cobbled street and then you see your hotel. The hotel is in 2 parts - the very old part, where you find reception is on the right all dark wood and tapestries. The car park is on the right on the other side of the road, next to the restaurant, bar and bedrooms. We had taken our cat Elvis with us (long story!) and the hotel were happy to accommodate pets in the room. The hotel room was in the roof of the new building - really warm, cosy and modern with wooden beams, and a patio door to look down over the gorge with great views. The room had a hairdryer,TV (BBC), a huge comfortable bed, bath and shower. No coffee making facilities but a good bar and restaurant downstairs. We ate the 26 Euro 3 course meal at the restaurant overlooking the gorge, which was excellent. The food was cooked to perfection with big portions. I couldn't fault this hotel in any way - the staff were helpful and friendly and spoke English, the rooms were good, as was the food and the location is absolutely magical.  Nice staff, perfect location, good breakfast. All that for a great price.  Excellent reception, large room, great view, best retaurant in Rocamadour, quiet A/C that really worked. Verry good parking and excellent location in the centre.  Rocamadour, a three star attraction, is perched on the side of a rock clift valley so that the hotels and restaurants have rather spectacular views. It is a busy tourist center so arrive late in the day when the street (just one) is less crowded but the shops, restaurants and historic sights are still open.  Great location with stunning views from rooms in the extension over the restaurant. Our room was over the street side but no noise or distraction from a good sleep. Good aircon in rooms and all public areas. Menu in restaurant. We stayed one night in June, I imagine it could be a lot busier in peak season. Good hotel. Really pleased with the booking and service.  Hotel was fine. Attached restaurant served good meals and a great view of the valley. Breakfast buffet at 11E turned out to be a bargain. Maitre d' recommended good local wines with dinner. Service in hotel and restaurant was a little slow but friendly. Parking across the street was included and was extremely convenient.  hotel was in one of the most beutifull spots in france with beatifull views from both rooms of the valley and of the medival village that surrounds you.Exellent host at hotel . wonderfull experince , so wonderfull we couldnt leave straight away and so stayed another night.fully recomend to all.  hard to better for its location  Friendly helpful staff, wonderful restaurant, good clean rooms.  This hotel is wonderful! It has a cute, historical-French, comfortable decor in the rooms and lobby. I loved the lace window curtains and pretty, flowered bedspread. The bathroom was modern -- with a tub, too! Everything was spotlessly clean, and the bed was great for good sleeping. The front desk staff and housekeeping staff were exceptionally friendly and helpful. The hotel also has a casual cafe and a regular restaurant with breathtaking views from its outdoor and indoor seating. The food at both places was delicious! I really enjoyed my stay, and highly recommend this hotel.   Extremely helpful staff, perfect location, free parking in front of hotel.  Fast check in and check out. Excellent valet who is skilled at moving cars around in their tiny car park lot. Did not try the restaurant due to many many places to eat steps from the hotel but breakfast is offered. very close to the Cite Reilgieuse. Overall, I would stay again.   It is not the hotel's fault that it is so hard to park, but it doesn't help that the hotel is located in the middle of a pedestrian zone. You can drive your car there to leave with a valet, but no one tells you that so you arrive wondering where is my hotel and how many more hours must I look for parking. No exaggeration. The hotel should make an effort to inform guests of this problem. As for the hotel itself, the beds are really comfortable and the room clean. If I were to go back I might try the other big hotel, but I imagine neither is a draw in itself.  Nice location in the middle of the old town. The restaurant was very good. Lovely little place.  Fabulous hotel, almost a boutique hotel, perched on the side of Rocamodur with views of the valley.  There is a gracious and traditional French restaurant with windows on the valley side.  A small, friendly bar with a local aperitif, omelettes, burgers, and beer fronts the street side.  In season, a perfectly situated terrace, and for the lucky few, parking!  The staff was friendly, helpful, and kind regarding my extremely poor French.  Couldn't find a better location in Rocamadour - and with car parking!Friendly, helpful staff, excellent restaurant.   The hotel is about as central as you can get, to the point that it is difficult to weave through the pedestrian crowds to get to it. Location is everything but the rooms were very nice. The restaurant was good but not as good as it thinks and we had better value meals and better service elsewhere.  What a wonderful hotel. Right in the heart of Rocamadour. We parked right outside the hotel, the staff came out to greet us. They offered us a choice of 2wonderful rooms, both of which were lovely. I stay in a lot of hotels, but this one was exceptional for its location, great staff and the most comfiest bed!I can't wait to return to Racamadour and wouldn't hesitate to stay at the Best Western.Didn't have breakfast or dinner there but the restaursnt and bar looked lovely with a good menu.  We stayed at the walled mideaval city of Rrocamadour. This hotel almost transported back to the times of 13th century France. Hard to explain the location, the views and cliffs. The narrow walls of a city well preserved from the times that surrounds it. The food was amazing and so was the sights and sounds  The hotel staff was very friendly and helpful. Parking was a major relief given the very tight fit and rather stressful arrival to the hotel location. The dinner at the hotel restaurant was first rate and the view was fabulous. Breakfast was convenient and offered an ample variety.  What a lovely hotel in a superb spot - as you drive around the gorge on the bendy road, you suddenly see the village clinging to the cliff, with with its turrets and towers and the ancient stone entrance arch that doesn't look big enough to drive your car through, but you can, then down the narrow cobbled street and then you see your hotel. The hotel is in 2 parts - the very old part, where you find reception is on the right all dark wood and tapestries. The car park is on the right on the other side of the road, next to the restaurant, bar and bedrooms. We had taken our cat Elvis with us (long story!) and the hotel were happy to accommodate pets in the room. The hotel room was in the roof of the new building - really warm, cosy and modern with wooden beams, and a patio door to look down over the gorge with great views. The room had a hairdryer,TV (BBC), a huge comfortable bed, bath and shower. No coffee making facilities but a good bar and restaurant downstairs. We ate the 26 Euro 3 course meal at the restaurant overlooking the gorge, which was excellent. The food was cooked to perfection with big portions. I couldn't fault this hotel in any way - the staff were helpful and friendly and spoke English, the rooms were good, as was the food and the location is absolutely magical.  Nice staff, perfect location, good breakfast. All that for a great price.  Excellent reception, large room, great view, best retaurant in Rocamadour, quiet A/C that really worked. Verry good parking and excellent location in the centre.  Rocamadour, a three star attraction, is perched on the side of a rock clift valley so that the hotels and restaurants have rather spectacular views. It is a busy tourist center so arrive late in the day when the street (just one) is less crowded but the shops, restaurants and historic sights are still open.  Great location with stunning views from rooms in the extension over the restaurant. Our room was over the street side but no noise or distraction from a good sleep. Good aircon in rooms and all public areas. Menu in restaurant. We stayed one night in June, I imagine it could be a lot busier in peak season. Good hotel. Really pleased with the booking and service.  Hotel was fine. Attached restaurant served good meals and a great view of the valley. Breakfast buffet at 11E turned out to be a bargain. Maitre d' recommended good local wines with dinner. Service in hotel and restaurant was a little slow but friendly. Parking across the street was included and was extremely convenient.  hotel was in one of the most beutifull spots in france with beatifull views from both rooms of the valley and of the medival village that surrounds you.Exellent host at hotel . wonderfull experince , so wonderfull we couldnt leave straight away and so stayed another night.fully recomend to all.  hard to better for its location  Friendly helpful staff, wonderful restaurant, good clean rooms. ",0.49,0.59,0.51,"""neutral"""
